{
  "$schema": "https://json-schema.org/draft/2020-12/schema",
  "$id": "https://raw.githubusercontent.com/artalar/tabthrough/main/schema/guide-v1.json",
  "title": "Tabthrough guide document, version 1",
  "type": "object",
  "required": ["version", "steps"],
  "properties": {
    "$schema": { "type": "string" },
    "version": { "const": 1 },
    "createdAt": { "type": "string", "format": "date-time" },
    "topic": { "type": "string", "minLength": 1, "maxLength": 48, "pattern": "^[a-z0-9]+(?:-[a-z0-9]+)*$" },
    "cursor": { "type": "integer", "minimum": -1, "maximum": 499 },
    "summary": { "type": "string", "maxLength": 600 },
    "generator": {
      "type": "object",
      "properties": {
        "name": { "type": "string", "maxLength": 100 },
        "version": { "type": "string", "maxLength": 50 },
        "model": { "type": "string", "maxLength": 100 }
      },
      "additionalProperties": false
    },
    "scope": {
      "type": "object",
      "required": ["kind"],
      "properties": {
        "kind": { "enum": ["workingTree", "commit", "range"] },
        "base": { "type": "string", "maxLength": 200 },
        "head": { "type": "string", "maxLength": 200 },
        "diffDigest": { "type": "string", "pattern": "^sha256:[0-9a-f]{64}$" }
      },
      "additionalProperties": false
    },
    "defaults": {
      "type": "object",
      "properties": {
        "mergeStrategy": { "enum": ["merge", "replace"], "default": "merge" },
        "maxLinesPerStep": { "type": "integer", "minimum": 1, "maximum": 500 },
        "finish": { "$ref": "#/$defs/finish" }
      },
      "additionalProperties": false
    },
    "files": {
      "type": "object",
      "propertyNames": { "type": "string", "maxLength": 400 },
      "additionalProperties": {
        "type": "object",
        "properties": {
          "significance": { "enum": ["critical", "high", "normal", "low", "skip"] },
          "rationale": { "type": "string", "maxLength": 120 }
        },
        "additionalProperties": false
      }
    },
    "steps": {
      "type": "array",
      "maxItems": 500,
      "items": { "$ref": "#/$defs/step" }
    }
  },
  "additionalProperties": false,
  "$defs": {
    "finish": {
      "type": "object",
      "properties": {
        "hooks": { "type": "boolean" },
        "sign": { "type": "boolean" }
      },
      "additionalProperties": false
    },
    "range": {
      "type": "object",
      "required": ["start"],
      "properties": {
        "start": { "type": "integer", "minimum": 1 },
        "end": { "type": "integer", "minimum": 1 },
        "side": { "enum": ["new", "old"], "default": "new" }
      },
      "additionalProperties": false
    },
    "step": {
      "type": "object",
      "required": ["id", "path", "rationale"],
      "properties": {
        "id": { "type": "string", "pattern": "^[A-Za-z0-9._:-]{1,64}$" },
        "path": { "type": "string", "minLength": 1, "maxLength": 400 },
        "rationale": { "type": "string", "minLength": 1, "maxLength": 120 },
        "order": { "type": "integer" },
        "ranges": { "type": "array", "items": { "$ref": "#/$defs/range" }, "maxItems": 50 },
        "significance": {
          "enum": ["critical", "high", "normal", "low", "skip"],
          "default": "normal"
        },
        "grouping": {
          "enum": ["atomic", "split", "mergeWithNext"],
          "default": "atomic"
        },
        "title": { "type": "string", "maxLength": 60 },
        "notes": { "type": "string", "maxLength": 2000 },
        "dependsOn": { "type": "array", "items": { "type": "string" }, "maxItems": 20 },
        "tags": { "type": "array", "items": { "type": "string", "maxLength": 40 }, "maxItems": 10 }
      },
      "additionalProperties": false
    }
  }
}
