{
  "$schema": "https://raw.githubusercontent.com/artalar/tabthrough/main/schema/guide-v1.json",
  "version": 1,
  "scope": { "kind": "workingTree", "base": "HEAD" },
  "summary": "Read-only and Rebase clicks did nothing because the webview dropped chooseMode. The test names that gap; the extracted allowlists include it in both sets; sidebar.ts forwards the payload again.",
  "files": {
    ".tabthrough-guide.json": { "significance": "skip", "rationale": "The sidecar this walk is written into" }
  },
  "steps": [
    {
      "id": "the-gap",
      "order": 10,
      "path": "test/unit/sidebar.test.ts",
      "ranges": [{ "start": 221, "end": 243 }],
      "significance": "critical",
      "title": "Mode picker must reach chooseMode",
      "rationale": "The failure the rest of the diff answers — clicks posted a command the allowlist dropped",
      "notes": "Both sets are required. SIDEBAR_COMMANDS lets the message through; PAYLOAD_COMMANDS is what actually forwards `readonly` or `rebase`. Missing either one looks like a dead button."
    },
    {
      "id": "both-allowlists",
      "order": 20,
      "path": "src/ui/sidebar-commands.ts",
      "ranges": [{ "start": 1, "end": 41 }],
      "significance": "critical",
      "title": "chooseMode is on both allowlists",
      "rationale": "The contract the test above asserts — extracted so the test can import it without vscode",
      "notes": "`chooseMode` sits with setupBack in the message set and with selectCommit in the payload set. The payload set is the one that was easy to forget: without it the handler runs with no mode and still does nothing.",
      "dependsOn": ["the-gap"]
    },
    {
      "id": "sidebar-forwards",
      "order": 30,
      "path": "src/ui/sidebar.ts",
      "ranges": [{ "start": 11, "end": 11 }],
      "significance": "high",
      "title": "Webview imports the shared allowlists",
      "rationale": "First consumer — the message handler that used to keep the sets inline and omit chooseMode",
      "dependsOn": ["both-allowlists"]
    }
  ]
}
